{
  "schema_version": "1.0",
  "converter": {"name": "example-adapter", "version": "1.0.0"},
  "source": {"format": "example-case", "version": "1"},
  "target": {"openfisca_core": "44.8.0", "country_package": "openfisca-country-template", "country_package_version": "8.0.0"},
  "outcome": "success",
  "output_emitted": true,
  "diagnostics": []
}
